"dataset_id","title","species","tissues","organ_parts","cell_types","cells","spots","genes","development_stages","sex","stomics_technologies","sample_number","sections_number","disease","browser","summary","overall_design","submission_date","last_modified","contributors","contacts","citation","accessions","platforms","pmid","dataset_quality"
"STDS0000203","The neurons that restore walking after paralysis [snRNA-seq]","Mus musculus","Spinal cord","","","0","82093","22806","","","10x Visium","24","24","","","Here, we show that epidural electrical stimulation (EES) of the lumbar spinal cord applied during neurorehabilitation (EESREHAB) restored walking in nine people with chronic spinal cord injury (SCI). This recovery involved a reduction of the metabolic activity in the lumbar spinal cord during walking. We hypothesized that this unexpected reduction reflects activity-dependent selection of specific neuronal subpopulations that become essential to walk after SCI. To identify these putative neurons, we modelled the technological and therapeutic features underlying EESREHAB in mice. We applied single-nucleus RNA sequencing and spatial transcriptomics to the spinal cord of these mice to chart a spatially-resolved molecular atlas of recovery from paralysis. We then employed cell type and spatial prioritization to uncover the neurons involved in the recovery of walking. A single population of excitatory interneurons nested within intermediate laminae emerged. Although these neurons were not necessary to walk before SCI, we demonstrate that they are essential to regain walking following SCI. In turn, augmenting their activity instantly phenocopied the recovery of walking enabled by EESREHAB. We thus identified a recovery-organizing neuronal subpopulation that is necessary and sufficient to regain walking after SCI. Moreover, our methodology establishes a framework to identify the neurons producing complex behaviours using molecular cartography.","We used single-nucleus RNA sequencing (snRNA-seq) to profile the lumbar spinal cord of mice. We devised a progression of eight experimental conditions that captured the key therapeutic features of EESREHAB. We obtained high-quality transcriptomes from 82,093 nuclei that were evenly represented across 24 mice from all eight conditions.

Mice were divided in three experimental groups: uninjured, SCI (no neurorehabilitation), and EESREHAB. At the end of the experimental period, mice were terminated to harvest fresh tissues or perfused and dissected. Half of the groups of mice underwent a terminal experimental condition immediately before being terminated, which is denoted by     final_condition. If more than one component was integrated in the terminal experimental condition, the additional component is denoted by  ::. Group 1 (uninjured) consisted of uninjured mice that did not perform a terminal behavioral task. Mice in Group 2 (SCI) received a contusion SCI and did not perform a terminal behavioral task. Mice in Group 3 (EESREHAB) received a contusion SCI and followed EESREHAB  for four weeks, but did not perform a terminal behavioral task.  Mice in Group 4 (SCI   EES::walking) received a contusion SCI and walked with EESON  for 30 minutes immediately before being terminated. Mice in Group 5 (EESREHAB   EES::walking) received a contusion SCI and followed EESREHAB  for four weeks, and walked with EESON  for 30 minutes immediately before being terminated. Mice in Group 6 (EESREHAB   EES) received a contusion SCI and and followed EESREHAB  for four weeks, and were stimulated for 30 minutes with EES just below motor threshold immediately before being terminated. Mice in Group 7 (EESREHAB   EES::cortex) received a contusion SCI and followed EESREHAB  for four weeks, and walked with optogenetic stimulation of the motor cortex for 30 minutes immediately before being terminated. Mice in Group 8 (EESREHAB   EES::cortex::walking) received a contusion SCI and followed EESREHAB  for four weeks, and walked with EESON  and optogenetic stimulation of the motor cortex for 30 minutes immediately before being terminated.","2021-09-17 00:00:00","2022-11-18 00:00:00","Squair, Jordan W;Kathe, Claudia;Skinnider, Michael A;Hutson, Thomas;Regazzi, Nicola;Gautier, Matthieu;Demesmaeker, Robin;Komi, Salif;Ceto, Steven;James, Nicholas D;Cho, Newton;Baud, Laetitia;Galan, Katia;Matson, Kaya J;Rowald, Andreas;Kim, Kyungjin;Wang, Ruijia;Prior, John O;Asboth, Leonie;Barraud, Quentin;Lacour, Stephanie P;Levine, Ariel J;Wagner, Fabien;Bloch, Jocelyne;Courtine, Grégoire","","Kathe, Claudia et al. “The neurons that restore walking after paralysis.” Nature vol. 611,7936 (2022): 540-547. doi:10.1038/s41586-022-05385-7","https://www.ncbi.nlm.nih.gov/geo/query/acc.cgi?acc=GSE184370","Illumina HiSeq 2500","36352232","2"
"STDS0000195","The neurons that restore walking after paralysis [spatial transcriptomics]","Mus musculus","Spinal cord","","","0","0","0","","","10x Visium","14","14","","","Here, we show that epidural electrical stimulation (EES) of the lumbar spinal cord applied during neurorehabilitation (EESREHAB) restored walking in nine people with chronic spinal cord injury (SCI). This recovery involved a reduction of the metabolic activity in the lumbar spinal cord during walking. We hypothesized that this unexpected reduction reflects activity-dependent selection of specific neuronal subpopulations that become essential to walk after SCI. To identify these putative neurons, we modelled the technological and therapeutic features underlying EESREHAB in mice. We applied single-nucleus RNA sequencing and spatial transcriptomics to the spinal cord of these mice to chart a spatially-resolved molecular atlas of recovery from paralysis. We then employed cell type and spatial prioritization to uncover the neurons involved in the recovery of walking. A single population of excitatory interneurons nested within intermediate laminae emerged. Although these neurons were not necessary to walk before SCI, we demonstrate that they are essential to regain walking following SCI. In turn, augmenting their activity instantly phenocopied the recovery of walking enabled by EESREHAB. We thus identified a recovery-organizing neuronal subpopulation that is necessary and sufficient to regain walking after SCI. Moreover, our methodology establishes a framework to identify the neurons producing complex behaviours using molecular cartography.","We used single-nucleus RNA sequencing (snRNA-seq) to profile the lumbar spinal cord of mice. We devised a progression of eight experimental conditions that captured the key therapeutic features of EESREHAB. We obtained high-quality transcriptomes from 82,093 nuclei that were evenly represented across 24 mice from all eight conditions.

Mice were divided in three experimental groups: uninjured, SCI (no neurorehabilitation), and EESREHAB. At the end of the experimental period, mice were terminated to harvest fresh tissues or perfused and dissected. Half of the groups of mice underwent a terminal experimental condition immediately before being terminated, which is denoted by     final_condition. If more than one component was integrated in the terminal experimental condition, the additional component is denoted by  ::. Group 1 (uninjured) consisted of uninjured mice that did not perform a terminal behavioral task. Mice in Group 2 (SCI) received a contusion SCI and did not perform a terminal behavioral task. Mice in Group 3 (EESREHAB) received a contusion SCI and followed EESREHAB  for four weeks, but did not perform a terminal behavioral task.  Mice in Group 4 (SCI   EES::walking) received a contusion SCI and walked with EESON  for 30 minutes immediately before being terminated. Mice in Group 5 (EESREHAB   EES::walking) received a contusion SCI and followed EESREHAB  for four weeks, and walked with EESON  for 30 minutes immediately before being terminated. Mice in Group 6 (EESREHAB   EES) received a contusion SCI and and followed EESREHAB  for four weeks, and were stimulated for 30 minutes with EES just below motor threshold immediately before being terminated. Mice in Group 7 (EESREHAB   EES::cortex) received a contusion SCI and followed EESREHAB  for four weeks, and walked with optogenetic stimulation of the motor cortex for 30 minutes immediately before being terminated. Mice in Group 8 (EESREHAB   EES::cortex::walking) received a contusion SCI and followed EESREHAB  for four weeks, and walked with EESON  and optogenetic stimulation of the motor cortex for 30 minutes immediately before being terminated.","2021-09-17 00:00:00","2022-11-18 00:00:00","Squair, Jordan W;Kathe, Claudia;Skinnider, Michael A;Hutson, Thomas;Regazzi, Nicola;Gautier, Matthieu;Demesmaeker, Robin;Komi, Salif;Ceto, Steven;James, Nicholas D;Cho, Newton;Baud, Laetitia;Galan, Katia;Matson, Kaya J;Rowald, Andreas;Kim, Kyungjin;Wang, Ruijia;Prior, John O;Asboth, Leonie;Barraud, Quentin;Lacour, Stephanie P;Levine, Ariel J;Wagner, Fabien;Bloch, Jocelyne;Courtine, Grégoire","","Kathe, Claudia et al. “The neurons that restore walking after paralysis.” Nature vol. 611,7936 (2022): 540-547. doi:10.1038/s41586-022-05385-7","https://www.ncbi.nlm.nih.gov/geo/query/acc.cgi?acc=GSE184369","Illumina HiSeq 4000","36352232","1"
"STDS0000182","Visium spatial transcriptomics analysis of lacrimal gland during chronic inflammation progression.","Mus musculus","Lacrimal Gland","","","0","5276","32285","4 months","Male","10x Visium","4","4","","","To identify the transcriptomic alterations within the different cellular compartments of the lacrimal gland during chronic inflammation, we analyzed the lacrimal glands of NOD.B10.H2b vs BALB/cJ with 10X Visium technology","We sequenced RNA from lacrimal glands cryosections (10μm) of BALB/cJ (control) and NOD.H2b (disease) mice aged of 4 months in duplicates.","2022-08-02 00:00:00","2022-11-17 00:00:00","Makarenkova, Helen;Mauduit, Olivier;Delcroix, Vanessa;Umazume, Takeshi;de Paiva, Cintia S;Dartt, Darlene A;Makarenkova, Helen P","","Mauduit, Olivier et al. “Spatial transcriptomics of the lacrimal gland features macrophage activity and epithelium metabolism as key alterations during chronic inflammation.” Frontiers in immunology vol. 13 1011125. 17 Oct. 2022, doi:10.3389/fimmu.2022.1011125","https://www.ncbi.nlm.nih.gov/geo/query/acc.cgi?acc=GSE210380","NextSeq 2000","36341342","5"
"STDS0000154","Checkpoint blockade-induced dermatitis and colitis are dominated by tissue resident memory T cells and  Th1/Tc1 cytokines","Homo sapiens","Colon","Skin irAE","","0","10796","17943","","","10x Visium","18","18","Dermatitis and Colitis","","Immune checkpoint blockade (ICB) is therapeutically successful in multiple cancer types. However, immune-related adverse events (irAE) frequently occur and can sometimes be life-threatening.
It is critical to understand the immunologic mechanisms of irAEs with the goal of finding novel treatment targets. Therefore, we studied tissues from irAE dermatitis cases using multiparameter immunofluorescence (IF), spatial transcriptomics,
and RNA in situ hybridization. Skin psoriasis cases were studied as a comparison, as a known Th17-driven disease, and colitis was investigated as a comparison. IF analysis revealed that CD4+ and CD8+ tissue resident memory T (TRM) cells
were preferentially expanded in the inflamed portion of skin in cutaneous irAEs compared to healthy skin controls. Spatial transcriptomics allowed focusing attention on areas containing TRM cells to discern their functional phenotype,
and revealed expression of Th1-associated genes in irAE, compared to Th17-asociated genes in psoriasis. Expression of a range of inhibitory checkpoint molecules was observed, including PD-1, CTLA-4, LAG-3, and TIGIT.
RNA in situ hybridization (RISH) technology combined with IF confirmed expression of IFN-γ, CXCL9, CXCL10, and TNF-α in additional irAE dermatitis cases and allowed us to identify production of IFN-γ within TRM cells specifically. The Th1-skewed phenotype was confirmed in irAE colitis cases compared to healthy colon.","spatial transcriptomics: skin irAE vs. Psoriasis, colon irAE vs. healthy colon","2022-07-29 00:00:00","2022-11-07 00:00:00","Reschke, Robin;Gajewski, Thomas F;Yu, Jovian;Rouhani, Sherin J;Olson, Daniel J;Zha, Yuanyuan;Shapiro, Jason W","","Reschke, Robin et al. “Checkpoint Blockade-Induced Dermatitis and Colitis Are Dominated by Tissue-Resident Memory T Cells and Th1/Tc1 Cytokines.” Cancer immunology research vol. 10,10 (2022): 1167-1174. doi:10.1158/2326-6066.CIR-22-0362","https://www.ncbi.nlm.nih.gov/geo/query/acc.cgi?acc=GSE210037","Illumina NovaSeq 6000 (Homo sapiens)","35977003","2"
"STDS0000159","The Deciphering of Mouse Uterine Microenvironment during Early Pregnancy","Mus musculus","Uterus","Embryo implantation site","","0","6753","32287","E7.5","","10x Visium;scRNA","4","4","","","This SuperSeries is composed of the SubSeries listed below.","Refer to individual Series","2021-07-30 00:00:00","2022-10-29 00:00:00","","","Li, Rong et al. “Spatial transcriptomic profiles of mouse uterine microenvironments at pregnancy day 7.5†.” Biology of reproduction vol. 107,2 (2022): 529-545. doi:10.1093/biolre/ioac061","https://www.ncbi.nlm.nih.gov/geo/query/acc.cgi?acc=GSE181170","Illumina NovaSeq 6000 (Mus musculus)","35357464","3"
"STDS0000158","Transcriptomic profiling of cardiac tissues from SARS-CoV-2 patients identifies DNA damage","Homo sapiens","Heart","Myocardium","","0","0","0","","","GeoMx DSP","50","0","COVID-19","","In this study, we investigated the landscape of cardiac tissues collected at rapid autopsy from 7 SARS-CoV-2, 2 pH1N1, and 6 control patients using targeted spatial transcriptomics approaches. The main outcomes for the study were to profile rapid autopsy samples collected from the COVID-19, pH1N1 and normal, non-viral deaths to determine transcriptional changes between the different cohorts. Although SARS-CoV-2 was not detected in cardiac tissue, host transcriptomics showed upregulation of genes associated with DNA damage and repair, heat shock, and M1-like macrophage infiltration in the cardiac tissues of COVID-19 patients. The DNA damage present in the SARS-CoV-2 patient samples, were further confirmed by g-H2Ax immunohistochemistry. In comparison, pH1N1 showed upregulation of Interferon-stimulated genes (ISGs), in particular interferon and complement pathways, when compared with COVID-19 patients.","In this dataset, we capture GeoMx DSP RNA profiles of myocardial tissue from SARS-CoV2 infected patients aswell as pH1N1 and control specimens","2022-08-26 00:00:00","2022-10-28 00:00:00","Kulasinghe, A K;Tan, C W","","Kulasinghe, Arutha et al. “Transcriptomic profiling of cardiac tissues from SARS-CoV-2 patients identifies DNA damage.” Immunology vol. 168,3 (2023): 403-419. doi:10.1111/imm.13577","https://www.ncbi.nlm.nih.gov/geo/query/acc.cgi?acc=GSE212119","Illumina NovaSeq 6000 (Homo sapiens);Illumina NovaSeq 6000 (blank sample)","36107637","2"
"STDS0000149","Spatiotemporal transcriptomes of orchid flowers","Phalaenopsis aphrodite","Flower","Sagittal section","","0","8253","28903","8 days after budding","","10x Visium","3","3","","","We performed spatial transcriptome sequencing of orchid to provide spatial cell atlas of floral organogenesis.","Phalaenopsis Big Chili flowers at early developing stages sequenced on 10X Visium platform","2022-03-08 00:00:00","2022-10-24 00:00:00","Liu, Chang;Leng, Jing;Li, Yonglong;Ge, Tingting;Li, Jinglong;Chen, Yamao;Guo, Chunce;Qi, Ji","","Liu, Chang et al. “A spatiotemporal atlas of organogenesis in the development of orchid flowers.” Nucleic acids research vol. 50,17 (2022): 9724-9737. doi:10.1093/nar/gkac773","https://www.ncbi.nlm.nih.gov/geo/query/acc.cgi?acc=GSE198128","Illumina NovaSeq 6000 (Phalaenopsis aphrodite)","36095130","5"
"STDS0000165","Spatial transcriptomics tools allow for regional exploration of heterogeneous muscle pathology in the pre-clinical rabbit model of rotator cuff tear","Oryctolagus cuniculus","Muscle","","","0","6970","21139","","","10x Visium","4","4","Rotator cuff tear","","Conditions affecting skeletal muscle, such as chronic rotator cuff tears, low back pain, dystrophies, and many others often share changes in muscle phenotype: intramuscular adipose and fibrotic tissue increase while contractile tissue is lost. The underlying changes in cell populations and cell ratios observed with these phenotypic changes complicate the interpretation of tissue-level transcriptional data. Novel single cell transcriptomics has limited capacity to address this problem because muscle fibers are too long to be engulfed in single cell droplets and single nuclei transcriptomics are complicated by muscle fibers’ multinucleation. Therefore, the goal of this project was to evaluate the potential and challenges of a spatial transcriptomics technology to add dimensionality to transcriptional data in an attempt to better understand regional cellular activity in heterogeneous skeletal muscle tissue.","Fresh and 6 years old snapfrozen healthy and tenotomized rabbit supraspinatus muscle sections were mounted on 10x Visium slides","2022-08-08 00:00:00","2022-10-14 00:00:00","Ruoss, Severin;Esparza, Mary C;Vasquez-Bolanos, Laura S;Nasamran, Chanond A;Fisch, Kathleen M;Engler, Adam J;Ward, Samuel R","","Ruoss, Severin et al. “Spatial transcriptomics tools allow for regional exploration of heterogeneous muscle pathology in the pre-clinical rabbit model of rotator cuff tear.” Journal of orthopaedic surgery and research vol. 17,1 440. 4 Oct. 2022, doi:10.1186/s13018-022-03326-8","https://www.ncbi.nlm.nih.gov/geo/query/acc.cgi?acc=GSE210773","Illumina NovaSeq 6000 (Oryctolagus cuniculus)","36195913","3"
"STDS0000164","Spatial gene expression-based, non-small cell lung carcinoma patients with paired brain metastases","Homo sapiens","Lung","","Metastatic lung cancer in a lymph node;tumor immune microenviroment in the metastatic brain;tumor immune microenviroment in the primary lung cancer;Metastatic lung cancer in the brain;primary lung cancer;non-tumor brain;tumor brain microenviroment in metastatic brain","0","0","0","","","GeoMx DSP","120","0","Non-small cell lung cancer","","Spatial RNA-seq were successfully constructed through expression profiling of a total of 18,694 genes in non-small cell lung cancer (NSCLC) cases with paired brain metastases.","In the study presented here, 35 cases from a well-defined cohort of 44 NSCLC cases with paired brain metastases was used to acquire expression profiles of a total of 18,694 unique genes.","2022-04-10 00:00:00","2022-10-12 00:00:00","Abdo, Rober","","Zhang, Qi et al. “The spatial transcriptomic landscape of non-small cell lung cancer brain metastasis.” Nature communications vol. 13,1 5983. 10 Oct. 2022, doi:10.1038/s41467-022-33365-y","https://www.ncbi.nlm.nih.gov/geo/query/acc.cgi?acc=GSE200563","NextSeq 550 (Homo sapiens)","36216799","2"
"STDS0000160","A cellular hierarchy in melanoma uncouples growth and metastasis","Homo sapiens;Mus musculus","Skin","Tail skin","cell line:MM047","0","0","0","","","10x Visium;scRNA;Stereo-Seq","0","3","Melanoma","","Although melanoma is notorious for its high degree of heterogeneity and plasticity, the origin and magnitude of cell state diversity remains poorly understood. Equally, it is not known whether melanoma growth and metastatic dissemination are supported by overlapping or distinct melanoma subpopulations. By combining mouse genetics, unbiased lineage tracing and quantitative modelling, single-cell and spatial transcriptomics, we provide evidence of a hierarchical model of tumour growth that mirrors the cellular and molecular logic underlying embryonic neural crest cell fate specification and differentiation. Our findings indicate that tumorigenic competence is associated with a spatially localized perivascular niche environment, a phenotype acquired through a NOTCH3-dependent intercellular communication pathway established by endothelial cells. Consistent with a model in which only a fraction of melanoma cells is fated to fuel growth, temporal single-cell tracing of a population of melanoma cells harbouring a mesenchymal-like state revealed that these cells do not contribute to primary tumour growth but, instead, constitutes a pool of metastatic-initiating cells that can switch cell identity while disseminating to secondary organs. Our data provide a spatially and temporally resolved map of the diversity and trajectories of cancer cell states within the evolving melanoma ecosystem and suggest that the ability to support growth and metastasis are limited to distinct pools of melanoma cells. The observation that these phenotypic competencies can be dynamically acquired upon exposure to specific niche signals warrant the development of therapeutic strategies that interfere with the cancer cell reprogramming activity of such microenvironmental cues.","scRNA-Seq and bulk RNA-Seq","2022-07-06 00:00:00","2022-10-07 00:00:00","Rambow, Florian;Karras, Panagiotis;Pozniak, Joanna","","Karras, Panagiotis et al. “A cellular hierarchy in melanoma uncouples growth and metastasis.” Nature vol. 610,7930 (2022): 190-198. doi:10.1038/s41586-022-05242-7","https://www.ncbi.nlm.nih.gov/geo/query/acc.cgi?acc=GSE207592","Illumina NovaSeq 6000 (Homo sapiens);DNBSEQ-G400 (Mus musculus);Illumina NovaSeq 6000 (Mus)","36131018","2"
"STDS0000152","Intratumor heterogeneity and T cell exhaustion in primary CNS lymphoma","Homo sapiens","Lymph","lymphoma","","0","4602","17943","","","10x Visium","13","4","CNS lymphoma","","Single-cell transcriptomic atlas of leukocytes of biopsy fluid (n = 2), blood (n = 2) and CSF (n = 1), and spatial transcriptomics of biopsy tissue (n = 4) from primary CNS B cell lymphoma patients.","Single-cell RNA and BCR sequencing of paired biopsy fluid and blood and spatial transcriptomics in primary CNS lymphoma.","2022-05-22 00:00:00","2022-09-25 00:00:00","Heming, Michael;Lu, I-Na;Grauer, Oliver;Meyer zu Hörste G","","Heming, Michael et al. “Intratumor heterogeneity and T cell exhaustion in primary CNS lymphoma.” Genome medicine vol. 14,1 109. 24 Sep. 2022, doi:10.1186/s13073-022-01110-1","https://www.ncbi.nlm.nih.gov/geo/query/acc.cgi?acc=GSE203552","Illumina NovaSeq 6000 (Homo sapiens);NextSeq 2000 (Homo sapiens)","36153593","5"
"STDS0000155","Spatial transcriptomics of TSC angiomyolipoma","Homo sapiens","Kidney","Angiomyolipoma (AML)","","0","0","0","","","GeoMx DSP","24","0","Angiomyolipoma","","We performed spatial transcriptomics on one IS-dominant tumor and on SLS-dominant tumor. Our goal was to determin different immune infiltration in these two subtypes.","NanoString Digital Spatial Profiling (DSP) with Whole Transcriptome Atlas (WTA) was performed on one IS-dominant and one SLS-dominant tumor, with each tumor profiled for 12 ROIs.","2022-08-08 00:00:00","2022-09-15 00:00:00","Tang, Yan","","Tang, Yan et al. “Midkine expression by stem-like tumor cells drives persistence to mTOR inhibition and an immune-suppressive microenvironment.” Nature communications vol. 13,1 5018. 26 Aug. 2022, doi:10.1038/s41467-022-32673-7","https://www.ncbi.nlm.nih.gov/geo/query/acc.cgi?acc=GSE210755","Illumina NovaSeq 6000 (Homo sapiens)","36028490","2"
