"dataset_id","title","species","tissues","organ_parts","cell_types","cells","spots","genes","development_stages","sex","stomics_technologies","sample_number","sections_number","disease","browser","summary","overall_design","submission_date","last_modified","contributors","contacts","citation","accessions","platforms","pmid","dataset_quality"
"STDS0000062","Spatial transcriptome uncovers the mouse lung architectures and functions","Mus musculus","Lung","","alveolar type II;alveolar type I;vein;ciliated;artery;fibroblast","0","0","116011","5 weeks","Female","Stereo-Seq","1","3","","","Revealing the relationships between the tissue structures and transcriptomic information is significant for understanding the mechanisms and principles underpinning the biological processes in lung development and diseases. The widely transcriptomic technics, including bulk and single-cell RNA sequencing, cannot accurately restore the tissue location of the gene expression. The advanced spatial transcriptomic tools can fill this gap properly with in-situ RNA capturing and spatial barcode labeling and translating. However, the published spatial transcriptome data of lung is rare or low-quality. Here we harnessed the large-view and high-resolution capabilities of Stereo-seq, one of the most advanced spatial transcriptome tools, in a 5-week-old female mouse to uncover the lung functions with their tissue location resolved. We also found a gradient expression of a bunch of genes related to cell proliferation along the axis of the proximal-to-distal trachea. All the data provided by the study pave the way for further studies in lung development and disease in the future.","We applied Stereo-seq on a 5-week-old femal mouse following the manufacturer's protocol.","2022-01-11 00:00:00","2022-01-11 00:00:00","Yujia Jiang;Shijie Hao","haoshijie@genomics.cn","Jiang, Yujia et al. “Spatial Transcriptome Uncovers the Mouse Lung Architectures and Functions.” Frontiers in genetics vol. 13 858808. 9 Mar. 2022, doi:10.3389/fgene.2022.858808","https://db.cngb.org/search/project/CNP0002590/","DNBSEQ-T10","35391793","4"
"STDS0000061","Spatial transcriptomic profile of cervical squamous cell carcinoma","Homo sapiens","Cervical","Cervical tissue","epithelial;fibroblast;endothelial (EC);myofibroblast;immune;Cancer;CAFs","0","233087","43344","","Female","Stereo-Seq","18","18","Cervical squamous cell carcinoma","","To understand the etiological, structural, and immunological characteristics of cervical squamous cell carcinoma (CSCC), we conducted spatial transcriptomics (ST) experiments  for cervical samples from 16 individuals.","To understand the etiological, structural, and immunological characteristics of cervical squamous cell carcinoma (CSCC), we conducted spatial transcriptomics (ST) experiments  for cervical samples from 16 individuals.","2021-12-30 00:00:00","2021-12-30 00:00:00","Xun Xu;Yanzhou Wang;Junhua Li;Peng Wu","pengwu8626@tjh.tjmu.edu.cn","Ou, Zhihua et al. “Single-Nucleus RNA Sequencing and Spatial Transcriptomics Reveal the Immunological Microenvironment of Cervical Squamous Cell Carcinoma.” Advanced science (Weinheim, Baden-Wurttemberg, Germany) vol. 9,29 (2022): e2203040. doi:10.1002/advs.202203040","https://db.cngb.org/stomics/project/STT0000015","DNBSEQ-T10","35986392","1"
"STDS0000119","Spatial transcriptome analysis defines heme as a hemopexin-targetable inflammatoxin in the brain","Mus musculus","Brain","Coronal Brain","","0","19066","26124","","Male","10x Visium","7","0","","","After intracranial hemorrhages, heme is released from cell-free hemoglobin. This red blood cell toxin may drive secondary brain injury at the hematoma-brain interface. This study aimed to generate a spatially resolved map of the transcriptome-wide gene expression changes in the heme-exposed brain and define the potential therapeutic activity of the heme-binding protein hemopexin.","Spatial transcriptome analysis of mouse brain using the 10X genomics Visium spatial gene expression kit after stereotactic injections.","2021-08-14 00:00:00","2021-12-29 00:00:00","Buzzi, Raphael M;Akeret, Kevin;Hugelshofer, Michael;Schaer, Dominik J","raphael.buzzi@usz.ch","Buzzi, Raphael M et al. “Spatial transcriptome analysis defines heme as a hemopexin-targetable inflammatoxin in the brain.” Free radical biology & medicine vol. 179 (2022): 277-287. doi:10.1016/j.freeradbiomed.2021.11.011","https://www.ncbi.nlm.nih.gov/geo/query/acc.cgi?acc=GSE182127","GPL24247","34793930","5"
"STDS0000124","Characterizing Neonatal Heart Maturation, Regeneration, and Scar Resolution Using Spatial Transcriptomics [spatial]","Mus musculus","","","","0","19968","32285","","","10x Visium","4","0","","","We use spatial transcriptomics to establish regional transcriptional profile of neonatal heart tissue obtained at indicated timpoints after apical resection surgery.","The cardiac apex was resected at P2, within the regenerative window, and hearts were isolated at indicated timepoints for spatial transcriptomics.","2021-11-15 00:00:00","2021-12-23 00:00:00","Small, Eric M;Misra, Adwiteeya;Baker, Cameron","cameron_baker@urmc.rochester.edu","Misra, Adwiteeya et al. “Characterizing Neonatal Heart Maturation, Regeneration, and Scar Resolution Using Spatial Transcriptomics.” Journal of cardiovascular development and disease vol. 9,1 1. 21 Dec. 2021, doi:10.3390/jcdd9010001","https://www.ncbi.nlm.nih.gov/geo/query/acc.cgi?acc=GSE188888","GPL24247","35050211","5"
"STDS0000117","Comprehensive Atlas of the Mouse Urinary Bladder","Mus musculus","Bladder","Whole Bladder Nuclear;Whole Mouse Bladder;Whole Bladder;Whole Mouse Bladder;Dissociated Mouse Bladder;Detrusor layer of bladder","","0","4488","31053","","","10x Visium","4","0","","","We report the application of single-cell based sequencing for high throughput profiling of the mouse urinary bladder. By utilizing multiple dissociation techniques and library preparation techniques we generated an atlas comprising 43,119 cells including major cell types absent from previous reports. We found that previous single-cell profiling of the mouse bladder lacked a major cell type in the detrusor smooth muscle and incorrectly annotated other cell types such as mesothelial cells. Using the atlas, we elucidated aspects of bladder biology including urothelial differentiation, the identity of interstitial cells of Cajal, detrusor smooth muscle control and immune distributions. Finally, we combine the single-cell based sequencing with spatial transcriptomics and imaging mass cytometry to add spatial context to transcriptomic profiling.","Single cell and nucleus sequencing of the mouse urinary bladder paired with spatial transcriptomics and bulk RNA sequencing.","2021-07-14 00:00:00","2021-12-23 00:00:00","Dylan Baker;Paul Robson","baker@uchc.edu","Lemtiri-Chlieh, Fouad et al. “The hyperpolarization-activated, cyclic nucleotide-gated channel resides on myocytes in mouse bladders and contributes to adrenergic-induced detrusor relaxation.” American journal of physiology. Regulatory, integrative and comparative physiology vol. 323,1 (2022): R110-R122. doi:10.1152/ajpregu.00277.2021","https://www.ncbi.nlm.nih.gov/geo/query/acc.cgi?acc=GSE180128","GPL21103","","3"
"STDS0000233","EASI-FISH for thick tissue defines lateral hypothalamus spatio-molecular organization","Mus musculus","Brain","","","0","0","0","","","EASI-FISH","101","0","","","","","2021-12-22 00:00:00","2021-12-22 00:00:00","","","Wang, Yuhan et al. “EASI-FISH for thick tissue defines lateral hypothalamus spatio-molecular organization.” Cell vol. 184,26 (2021): 6361-6377.e24. doi:10.1016/j.cell.2021.11.024","https://janelia.figshare.com/articles/dataset/EASI-FISH_enabled_spatial_analysis_of_molecular_cell_types_in_the_lateral_hypothalamus/13749154","","34875226","2"
"STDS0000060","High-resolution spatiotemporal transcriptomic maps of developing Drosophila embryos and larvae","Drosophila melanogaster","Embryo","Embryo;Larvae","midgut;carcass;fat body;epidermis;salivary gland;CNS;hindgut;hemolymph;muscle;trachea","0","155684","12850","Embryo of 14-16 h after egg laying;Embryo of 16-18 h after egg laying;1st instar larva;2nd instar larva;3rd instar larva","","Stereo-Seq","5","90","Normal","","This database is intended to curate 3D spatial transcriptomes of all stages of Drosophila embryos and larvae generated by Stereo-seq. Drosophila melanogaster strain w1118 embryos were collected at two late stages (14-16 h and 16-18 h after egg laying, corresponding to stage 16~17 of embryogenesis) and all three stages were also collected. These samples were subject to cryosection to generate 7~10 μm thick slices. All slices of each sample were applied to Stereo-seq chips to capture their 2D spatial transcriptomes. All the 2D spatial transcriptomes of each sample were combined to recreate their 3D spatial transcriptomes. More samples of different stages will be added in the future. With these data, one could visualize and analyze spatial expression patterns of genes of interest, 3D reconstruct tissue-specific spatial transcriptomes by clustering and annotation, simulate tissue developmental trajectory across development, identify cell signalling pathways and gene regulatory networks, examine gene functions in their intact spatial context etc.","","2021-12-21 00:00:00","2021-12-21 00:00:00","Mingyue Wang;Qinan Hu;Tianhang Lv;Yuhang Wang;Rong Xiang;Qing Lan;Zhencheng Tu;Yanrong Wei;Kai Han;Yanru An","liulongqi@genomics.cn","Wang, Mingyue et al. “High-resolution 3D spatiotemporal transcriptomic maps of developing Drosophila embryos and larvae.” Developmental cell vol. 57,10 (2022): 1271-1283.e4. doi:10.1016/j.devcel.2022.04.006","https://db.cngb.org/search/project/CNP0002189/;https://db.cngb.org/stomics/drosophila_melanogaster/3d/E14-16a;https://db.cngb.org/stomics/drosophila_melanogaster/3d/E16-18a;https://db.cngb.org/stomics/drosophila_melanogaster/3d/L1a;https://db.cngb.org/stomics/drosophila_melanogaster/3d/L2a;https://db.cngb.org/stomics/drosophila_melanogaster/3d/L3b;https://db.cngb.org/stomics/flysta3d/","DNBSEQ-T1","35512700","5"
"STDS0000102","PRDM16 Functions as A Compact Myocardium-Enriched Transcription Factor Required to Maintain Compact Myocardial Cardiomyocyte Identity in Left Ventricle (Spatial Transcriptomics)","Mus musculus","Heart","","","0","1330","32285","E13.5;E15.5","","10x Visium","4","0","","","The loss of compact myocardial cardiomyocyte (compact CM) identity suggests that PRDM16 deficiency may dramatically alter the cellular composition in left ventricular (LV) compact myocardium. To test this hypothesis, we performed single-cell RNA-seq (scRNA-seq) to examine gene dysreulation in Prdm16cKO heart. We also performed Visium Spatial Transcriptomics (ST) to facilitate mapping CM clusters to their original locations in the heart. As a result, we were able to demonstrate gene misregulation in Prdm16cKO mouse mainly occurred in LV compact CM.","Two pairs of Prdm16cKO/WT E13.5  mouse hearts and two pairs of Prdm16cKO/control E15.5  mouse hearts were used for Visium Spatial Transcriptomics (ST).","2021-07-03 00:00:00","2021-12-21 00:00:00","Tongbin Wu;Zhengyu Liang;Ju Chen","juchen@health.ucsd.edu","Wu, Tongbin et al. “PRDM16 Is a Compact Myocardium-Enriched Transcription Factor Required to Maintain Compact Myocardial Cardiomyocyte Identity in Left Ventricle.” Circulation vol. 145,8 (2022): 586-602. doi:10.1161/CIRCULATIONAHA.121.056666","https://www.ncbi.nlm.nih.gov/geo/query/acc.cgi?acc=GSE179392;https://www.ncbi.nlm.nih.gov/geo/query/acc.cgi?acc=GSE179390","Illumina NovaSeq 6000","34915728","3"
"STDS0000116","Human prostate luminal epithelia adopt a club-like state in response to low androgen levels","Homo sapiens","Prostate","","","0","28883","36601","","","10x Visium","8","0","","","Spatial transcriptomics of treatment naive and 5-alpha reductase inhibitior treated human BPH tissue","Fresh human prostate specimens were embedded in OCT, slides were H&E stained and processed for 10x Genomics Visium spatial transcriptomics.","2021-06-25 00:00:00","2021-12-18 00:00:00","Strand, Douglas W;Henry, Gervaise H","gervaise.henry@utsouthwestern.edu","Joseph, Diya B et al. “5-Alpha reductase inhibitors induce a prostate luminal to club cell transition in human benign prostatic hyperplasia.” The Journal of pathology vol. 256,4 (2022): 427-441. doi:10.1002/path.5857","https://www.ncbi.nlm.nih.gov/geo/query/acc.cgi?acc=GSE178934","GPL24676","34928497","3"
"STDS0000140","Macaque Brain Atlas","Macaca fascicularis","Brain","","","0","95749","0","","","Stereo-Seq","1","3","","","Non-human primates provide a unique way to study the only model in which both developmental and pathological features of the brain in a species phylogenetically close to human. In the past decade, breakthrough advances in single-cell sequencing have enabled the mapping of cell taxonomy and heterogeneity in the developing and adult brain of different mammalian species. Here, we generated single-cell chromatin accessibility (single-cell ATAC) and transcriptomic data of 358,237 cells from three cortical regions of the adult cynomolgus monkey Macaca fascicularis brain. We then integrated this dataset with Stereo-seq (Spatio-Temporal Enhanced Resolution Omics-sequencing) of the corresponding cortical areas to assign topographic information to molecular and regulatory states.","","2021-12-16 00:00:00","2021-12-16 00:00:00","","","Lei, Ying et al. “Spatially resolved gene regulatory and disease-related vulnerability map of the adult Macaque cortex.” Nature communications vol. 13,1 6747. 8 Nov. 2022, doi:10.1038/s41467-022-34413-3","https://db.cngb.org/mba;https://db.cngb.org/search/project/CNP0000927/;https://db.cngb.org/stomics/publications/36347848","DNBSEQ-T10","36347848","4"
"STDS0000115","Spatial transcriptomics (Visium, Spatial 3' V1, 10x Genomics) analysis of heart tissues in a murine model of Kawasaki disease vasculitis","Mus musculus","Heart","","","0","3227","31053","","","10x Visium","2","0","","","Spatial transcriptomics (Visium, Spatial 3' V1, 10x Genomics) analysis of heart tissues from Lactobacillus casei cell wall extract (LCWE)-injected mice and control PBS-injected mice","Heart from one LCWE-injected and one PBS-injected mice were harvested one week after injection and sectioned to 10碌m and used for Visium Spatial Transcriptomics 3' V1","2021-06-23 00:00:00","2021-12-14 00:00:00","David Zemmour;Rebecca A Porritt;Magali N Rivas;Moshe Arditi","davidpz@fas.harvard.edu, david.puyraimond@gmail.com","Porritt, Rebecca A et al. “NLRP3 Inflammasome Mediates Immune-Stromal Interactions in Vasculitis.” Circulation research vol. 129,9 (2021): e183-e200. doi:10.1161/CIRCRESAHA.121.319153","https://www.ncbi.nlm.nih.gov/geo/query/acc.cgi?acc=GSE178799","GPL24247","34517723","3"
"STDS0000111","10X Visium Spatial transcriptomics of murine colon in steady state and during recovery after DSS colitis","Mus musculus","Colon","","","0","9984","31053","","","10x Visium","2","0","","","The limitation of single-cell or bulk transcriptomic profiling is the lack of spatial topographical context. Spatial transcriptomics (ST) allows sequencing of polyadenylated transcripts from a tissue section which can be spatially mapped onto the histological brightfield image using an array of barcoded oligo-dT capturing probes. Using the 10X Visium platform, here, we unbiasedly characterized the spatial transcriptomic landscape of murine colon in steady state and during mucosal healing upon dextran sodium sulfate (DSS) induced injury","Wild type C57BL/6J mice were exposed to DSS in drinking water for 7 days and then allowed to recover for 7 more days. Mouse colonic tissues were collected either on day 0 (without any exposure to DSS) or on day14 after exposure to DSS, Swisrolled and frozen in OCT. Mouse colonic tissues (day0 and day14) were cryo-sectioned (10uM) and placed on the already barcoded spots (6.5mm x 6.5mm) on the glass slide. Samples were processed according to 10X Visium spatial transcriptomics protocol and submitted for sequencing.","2021-03-26 00:00:00","2021-12-07 00:00:00","Srustidhar Das;Eduardo Villablanca;Ludvig Larsson","ludvig.larsson@scilifelab.se","Parigi, Sara M et al. “The spatial transcriptomic landscape of the healing mouse intestine following damage.” Nature communications vol. 13,1 828. 11 Feb. 2022, doi:10.1038/s41467-022-28497-0","https://www.ncbi.nlm.nih.gov/geo/query/acc.cgi?acc=GSE169749","GPL21103","35149721","5"
"STDS0000194","10X-single cell seq of B cells during colitis (d0 and d14)","Mus musculus","","","","0","8156","31053","","Female","10x Visium","2","2","","","B cells expand during the recovery after DSS-induced colonic inflammation. To investigate if a specific subtype is expanding and to analyse the transcriptional profile of these cells a transcriptional analysis on single cell level was carried out. In detail,  B cells were isolated from the colon of mice on day 0 (no treatment) or day 14 (recovery) after 7 days of DSS treatment by flow cytometric sorting and analyzed by 10X sequencing.","Female C57BL/6J mice were treated with 2%DSS via the drinking water followed by 7 days of recovery. Lymphocytes were isolated from the colonic lamina propria on day 0 (ctrl) and day 14 (recovery) and B cells were sorted using flow cytometry. Afterwards cells were processed according to 10x Genomics protocol for Chromium Single cell 3’ kit (version 2) and submitted for sequencing","2020-12-21 00:00:00","2021-12-07 00:00:00","Villablanca, Eduardo J;Frede, Annika;Sorini, Chiara;Tripathi, Kumar P","","Frede, Annika et al. “B cell expansion hinders the stroma-epithelium regenerative cross talk during mucosal healing.” Immunity vol. 55,12 (2022): 2336-2351.e12. doi:10.1016/j.immuni.2022.11.002","https://www.ncbi.nlm.nih.gov/geo/query/acc.cgi?acc=GSE163637","Illumina HiSeq 2500","36462502","2"
"STDS0000126","Time-course single-cell and spatial transcriptomics of reovirus-induced myocarditis in neonatal mice","Mus musculus","Heart","Heart;Ileum","","0","16270","54848","","","10x Visium","8","0","","","A significant fraction of sudden death in young adults is due to myocarditis, an inflammatory disease of the heart, most often caused by viral infection. Here we used single-cell and spatially resolved RNA sequencing (RNA-seq) to study the cellular and spatial  heterogeneity of myocarditic processes in the hearts of reovirus-infected neonatal mice at multiple predetermined time points after initial infection at the primary site of infection. We further applied these technologies to study the innate response to reovirus infection in the intestine. In addition, we performed time-dependent single-cell RNA-seq (scRNA-seq) of cardiac tissues of mice infected with a reovirus point mutant that does not cause myocarditis. To establish viral tropism, we implemented molecular enrichment of non-polyadenylated viral transcripts that were otherwise poorly represented in the transcriptomes. Our measurements give insight into the cardiac cell-type specificity of innate immune responses, into the tropism of the virus in the intestine and the heart, and into the transcriptional states of cell types involved in the production of inflammatory cytokines and the recruitment of circulating immune cells. Analyses of spatially restricted gene expression in myocarditic regions and the border zone around those regions identified injury and stress responses in different cell types, including cardiomyocytes. Overall, our data identify spatially restricted cellular interactions and cell-type specific host responses during reovirus-induced myocarditis.","Time-course single-cell and spatial transcriptomics of ileum and heart tissues from reovirus-infected neonatal mice","2021-11-26 00:00:00","2021-12-05 00:00:00","Madhav Mantri;Meleana M Hinchman;John L Parker;Iwijn De Vlaminck","id93@cornell.edu","Mantri, Madhav et al. “Spatiotemporal transcriptomics reveals pathogenesis of viral myocarditis.” Nature cardiovascular research vol. 1,10 (2022): 946-960. doi:10.1038/s44161-022-00138-1","https://www.ncbi.nlm.nih.gov/geo/query/acc.cgi?acc=GSE189636","GPL21103","36970396","2"
"STDS0000122","Spatial transcriptomic studies of the small intestine from WT and DDX5△IEC (KO) mice","Mus musculus","","","","0","9984","32285","","","10x Visium","2","0","","","DDX5, a DEAD box containing RNA binding protein, is involved in multiple aspects of RNA metabolism and is abundantly expressed in all subsets of the intestinal epithelial cells (IEC). Here, we characterized the DDX5-dependent transcriptome in the small intestine. In the DDX5△IEC tissue, we found that secretory IEC lineage progenitor containing spots (Atoh1hi and Sox4hi) had reduced expression of Pou2f3, a master regulator of a subset of IECs called tuft cells. As a result of the loss of Pou2f3 expression in the progenitors, DDX5△IEC tissue harbored lower number of tuft cell containing spots (Dclk1hi) compare to WT tissues.","One intestine tissue from each genotype were obtained from 8wk old cohoused mice. Results of ileum epithelium from DDX5鈻矷EC mutant mice were compared to those from WT mice.","2021-09-21 00:00:00","2021-12-03 00:00:00","Long, Tianyun;Lemolo, Attilio;Telese, Francesca;Huang, Wendy M","wjh003@ucsd.edu","Long, Tianyun et al. “RNA binding protein DDX5 directs tuft cell specification and function to regulate microbial repertoire and disease susceptibility in the intestine.” Gut vol. 71,9 (2022): 1790-1802. doi:10.1136/gutjnl-2021-324984","https://www.ncbi.nlm.nih.gov/geo/query/acc.cgi?acc=GSE184564","GPL24247","34853057","2"
"STDS0000125","Spatiotemporal transcriptional atlas of lung adenocarcinoma from adenocarcinoma in situ to invasive carcinoma [ST]","Homo sapiens","","","","0","4992","36601","","","10x Visium","1","1","","","To illuminate the evolutionary trajectory of LUAD from AIS to IAC, high-throughput scRNA-seq and ST data were generated and integrated to create a large-scale, single-cell spatiotemporal atlas of LUAD. We compiled a multi-omics atlas of the early-stage LUAD invasion process that reflects the heterogeneity of cancer cells, the competitive polyclonal origin of LUAD, signalling interactions between cancer cells and the TME, and the pseudo-chronological nature of LUAD invasion. The spatial distribution characteristics of LUAD cells revealed the spatial heterogeneity of LUAD and the mechanism of spatial immune escape in LUAD, which provides strong evidence supporting clinical diagnosis and surgical intervention at the single-cell level.","Nine resected samples (TD1-9, three each from AIS, MIA and IAC cases) from nine treatment-na茂ve patients were collected for droplet-based scRNA-seq. In parallel, six paired samples were subjected to ST","2021-11-24 00:00:00","2021-12-02 00:00:00","Tao Jiang;Shiquan Sun;Yue Fan;Jianfei Zhu","xafanyue@xjtu.edu.cn","Zhu, Jianfei et al. “Delineating the dynamic evolution from preneoplasia to invasive lung adenocarcinoma by integrating single-cell RNA sequencing and spatial transcriptomics.” Experimental & molecular medicine vol. 54,11 (2022): 2060-2076. doi:10.1038/s12276-022-00896-9","https://www.ncbi.nlm.nih.gov/geo/query/acc.cgi?acc=GSE189487","GPL21103","36434043","2"
"STDS0000103","Single-Cell, Single-Nucleus and Spatial RNA Sequencing of the Human Liver Identifies Hepatic Stellate Cell and Cholangiocyte Heterogeneity","Homo sapiens","Liver","","","0","2265","36601","","","10x Visium","1","0","","","Comparison of single cell RNAseq and single nucleus RNAseq on four healthy human liver caudate lobes, with cell-types validated using one slice of a fifth healthy human for VISIUM Spatial Transcriptomics. Raw UMI count tables can be found here: https://figshare.com/projects/Human_Liver_SC_vs_SN_paper/98981
Processed Seurat Objects can be found here:
https://www.dropbox.com/sh/sso15ehqmrrh6mk/AACKHOsSlZW0_Zy9cbCkOmMfa?dl=0","Four healthy human liver caudate lobes were removed prior to transplantation into living recipients. A potion of each lobe was frozen then nuclei were extracted and sequenced with 10x Chromium while another portion was dissociated immediately while still fresh and isolated cells were sequenced with 10x Chromium.","2021-10-06 00:00:00","2021-12-02 00:00:00","Tallulah S Andrews;Jawairia Atif;Jeff C Liu;Sonya MacParland","tallulandrews@gmail.com","Andrews, Tallulah S et al. “Single-Cell, Single-Nucleus, and Spatial RNA Sequencing of the Human Liver Identifies Cholangiocyte and Mesenchymal Heterogeneity.” Hepatology communications vol. 6,4 (2022): 821-840. doi:10.1002/hep4.1854","https://www.ncbi.nlm.nih.gov/geo/query/acc.cgi?acc=GSE185477","Illumina HiSeq 2500","34792289","5"
