"dataset_id","title","species","tissues","organ_parts","cell_types","cells","spots","genes","development_stages","sex","stomics_technologies","sample_number","sections_number","disease","browser","summary","overall_design","submission_date","last_modified","contributors","contacts","citation","accessions","platforms","pmid","dataset_quality"
"STDS0000080","Sci-Space E14 Mouse Embryo Data","Mus musculus","Embryo","","","122278","0","52636","","","sci-Space","0","0","","","Spatial patterns of gene expression span many scales, and are shaped by both local (e.g. cell-cell interactions) and global (e.g. tissue, organ) context. However, most in situ methods for profiling gene expression either average local contexts or are restricted to limited fields of view. Here we introduce sci-Space, a scale-flexible method that retains single cell resolution while resolving spatial heterogeneity in gene expression at larger scales. As a proof-of-concept, we apply sci-Space to the developing mouse embryo (E14), capturing the approximate spatial coordinates of profiled cells from whole embryo serial sections.","Combinatorially indexed single cell TNA sequencing libraries. Each read contains a combination of PCR indices and a 3-prime barcode that uniquely identify the reads from a single cell. Sequenced molecules consist of both barcoded cDNA and barcoded synthetic hash-oligo molecules used to mark the spatial position from which a cell is derrived.","2021-02-12 00:00:00","2021-07-01 00:00:00","Sanjay R Srivatsan;Mary Regier","sanjays@uw.edu, sanjayrsrivatsan@gmail.com","Srivatsan, Sanjay R et al. “Embryo-scale, single-cell spatial transcriptomics.” Science (New York, N.Y.) vol. 373,6550 (2021): 111-117. doi:10.1126/science.abb9536","https://www.ncbi.nlm.nih.gov/geo/query/acc.cgi?acc=GSE166692","GPL21626","34210887","4"
"STDS0000011","Vitamin D sufficiency enhances differentiation of patient-derived prostate epithelial organoids","Homo sapiens","Prostate","Prostate epithelial organoids","stem cell;dividing cells;The “IntegrinHigh”;progenitor;luminal","19912","653","36648","","","10x Visium;scRNA","2","2","","","Spatially resolved gene expression was prepard by dissociated hman prostate tissue to single cells, and collected & prepped for RNA-seq using the Visium Spatial Gene Expression kit. 5000 cells were collected and sequenced at a depth of 50k cells/gene on a 2X150nt lane in a NovaSeq 6000. SpaceRanger alignment was performed to produce the RAW files","Two samples:ETOH, 25D","2020-10-20 00:00:00","2021-06-19 00:00:00","Garcia J;Loitz C;Nonn L","lnonn@uic.edu","McCray, Tara et al. “Vitamin D sufficiency enhances differentiation of patient-derived prostate epithelial organoids.” iScience vol. 24,1 101974. 5 Jan. 2021, doi:10.1016/j.isci.2020.101974","https://www.ncbi.nlm.nih.gov/geo/query/acc.cgi?acc=GSE159697;https://www.ncbi.nlm.nih.gov/geo/query/acc.cgi?acc=GSE142489","Illumina NovaSeq 6000","33458620","4"
"STDS0000094","Clump sequencing exposes the spatial expression programs of intestinal secretory cells","Mus musculus","","","","0","0","0","3 months;4 months","","ClumpSeq","0","0","","","We molecularly characterized Clumps and single cells from Jejunum. This enable us to uncover the zonation of rare secretory cells on crypt to villus axis.","mRNA profiles from clumps and single cells, EDTA isolated jejunum epithelial clumps and single cells were sequenced in several batches in an Illumina NextSeq.","2020-07-20 00:00:00","2021-06-15 00:00:00","Rita Manco;Inna Averbukh;Keren B Halpern;Porat Ziv;Ido Amit;Shalev Itzkovitz","","Manco, Rita et al. “Clump sequencing exposes the spatial expression programs of intestinal secretory cells.” Nature communications vol. 12,1 3074. 24 May. 2021, doi:10.1038/s41467-021-23245-2","https://www.ncbi.nlm.nih.gov/geo/query/acc.cgi?acc=GSE154714","GPL21626","34031373","2"
"STDS0000013","Single-cell spatial transcriptomic analysis reveals common and divergent features of developing postnatal granule cerebellar cells and medulloblastoma","Mus musculus","Cerebella","","Cerebellar granule neuron progenitors","0","24919","14146","","","Spatial Transcriptomics;scRNA","10","1","SHH medulloblastoma","","The progenitor/differentiation states of cerebellum granule cells have been investigated for many years. Deregulation of granule cells development is associated with the pathogenesis of medulloblastoma (MB).Our study reveals the cellular and spatial organization of cerebellar granule cells and provide direct evidence showing the similarity and discrepancy between normal development and tumorigenesis","Single cell mRNA profiles of 2 samples from Math1-GFP mice, 2 samples from Dcx-DsRed mice, 2 samples from WT mice and 3 SHH MBs from Patched+/- mice were generated by 10x Genomics plartform, without technical replication, and sequenced by NovaSeq 6000 (Illumina). Spatial transcriptomics (ST) profiles of 2 samples of P7 WT mice were generated by 10x Genomics plartform, without technical replication, and sequenced by NovaSeq 6000 (Illumina).","2020-08-21 00:00:00","2021-06-14 00:00:00","Wang J;Gao W","wj860520@163.com","Luo, Wenqin et al. “Single-cell spatial transcriptomic analysis reveals common and divergent features of developing postnatal granule cerebellar cells and medulloblastoma.” BMC biology vol. 19,1 135. 1 Jul. 2021, doi:10.1186/s12915-021-01071-8","https://www.ncbi.nlm.nih.gov/geo/query/acc.cgi?acc=GSE156633","Illumina NovaSeq 6000","34210306","3"
"STDS0000049","Human Breast Cancer: Ductal Carcinoma In Situ, Invasive Carcinoma (FFPE)","Homo sapiens","Breast","","","0","2518","17943","","Female","10x Visium","1","1","Breast Cancer","","5 µm section from Invasive Ductal Carcinoma of Homo sapiens Breast. FFPE tissue purchased from BioIVT Asterand Homo sapiens Tissue Specimens (BioIVT):","","2021-06-09 00:00:00","2021-06-09 00:00:00","","","","https://support.10xgenomics.com/spatial-gene-expression/datasets/1.3.0/Visium_FFPE_Human_Breast_Cancer","","","5"
"STDS0000048","Normal Human Prostate (FFPE)","Homo sapiens","Prostate","","","0","2543","17943","","Male","10x Visium","1","1","","","5 µm section from Homo sapiens prostate. FFPE tissue purchased from Indivumed Homo sapiens Tissue Specimens (Indivumed).","","2021-06-09 00:00:00","2021-06-09 00:00:00","","","","https://support.10xgenomics.com/spatial-gene-expression/datasets/1.3.0/Visium_FFPE_Human_Normal_Prostate","","","5"
"STDS0000046","Human Prostate Cancer, Adenocarcinoma with Invasive Carcinoma (FFPE)","Homo sapiens","Prostate","","","0","4371","17943","","Male","10x Visium","1","1","Prostate Cancer","","5 µm section from Adenocarcinoma of Homo sapiens Prostate. FFPE tissue purchased from Indivumed Homo sapiens Tissue Specimens (Indivumed).","","2021-06-09 00:00:00","2021-06-09 00:00:00","","","","https://support.10xgenomics.com/spatial-gene-expression/datasets/1.3.0/Visium_FFPE_Human_Prostate_Cancer","","","5"
"STDS0000009","Integrating Spatial Transcriptomics and Single-Cell RNA-seq Reveals the Gene Expression Profling of the Human Embryonic Liver","Homo sapiens","Embryo","Liver","B cell;dendritic cell (DC);DC1;DC2;early erythroblast;endothelial;HSC_MPP;fibroblast;hepatocyte;kupffer;ILC;late erythroblast;MEMP;mast cell;megakaryocyte;mid erythroblast;monocyte;monomac;neutrophilmyeloid;NK;pDC;Pre;PreB;ProB;VCAM1+","34339","4756","2705","8 PCW;17 PCW","","10x Visium","2","2","","","We use single-cell RNA-seq technology for unbiased analysis of fetal livers over developmental time from 8 postconception weeks (PCW) and 17 PCW in humans.","The sample contained one 8-postconception weeks and one 17-postconception weeks fetal livers.","2020-02-19 00:00:00","2021-06-09 00:00:00","Hou X;Dai Y","houxl115@126.com","Hou, Xianliang et al. “Integrating Spatial Transcriptomics and Single-Cell RNA-seq Reveals the Gene Expression Profling of the Human Embryonic Liver.” Frontiers in cell and developmental biology vol. 9 652408. 20 May. 2021, doi:10.3389/fcell.2021.652408","https://www.ncbi.nlm.nih.gov/geo/query/acc.cgi?acc=GSE167096","Illumina NovaSeq 6000","34095116","4"
"STDS0000007","Integration of spatial and single-cell transcriptomics localizes epithelial cell-immune cross-talk in kidney injury","Mus musculus;Homo sapiens","Kidney","","","0","8794","31055","59-year-old;8-10 weeks","Male","10x Visium;scRNA","6","4","Murine ischemia | Reperfusion injury (IRI) and cecal ligation puncture (CLP) models of AKI",""," Single cell sequencing studies have characterized the transcriptomic signature of cell types within the kidney. However, the spatial distribution of acute kidney injury (AKI) is regional and affects cells heterogeneously. We first optimized coordination of spatial transcriptomics and single nuclear sequencing datasets, mapping 30 dominant cell types to a human nephrectomy. The predicted cell type spots corresponded with the underlying histopathology. To study the implications of AKI on transcript expression, we then characterized the spatial transcriptomic signature of two murine AKI models: ischemia reperfusion injury (IRI) and cecal ligation puncture (CLP). Localized regions of reduced overall expression were associated with injury pathways. Using single cell sequencing, we deconvoluted the signature of each spatial transcriptomic spot, identifying patterns of colocalization between immune and epithelial cells. Neutrophils infiltrated the renal medulla in the ischemia model. Atf3 was identified as a chemotactic factor in S3 proximal tubules. In the CLP model, infiltrating macrophages dominated the outer cortical signature and Mdk was identified as a corresponding chemotactic factor. The regional distribution of these immune cells was validated with multiplexed CO-Detection by inDEXing (CODEX) immunofluorescence. Spatial transcriptomic sequencing complements single cell sequencing by uncovering mechanisms driving immune cell infiltration and detection of relevant cell subpopulations.","A single human reference nephrectomy (female aged 59 without histologic evidence of kidney disease) was acquired from the Biopsy Biobank Cohort of Indiana (BBCI). From age-matched 8-10 week old 129/ SvEv mice (Taconic Biosciences, Albany, New York), tissues were acquired from a sham mouse in which the abdomen was opened and sutured back and mice which underwent ischemia-reperfusion injury (IRI) or cecal ligation and puncture (CLP). In the IRI model both renal pedicles were exposed and clamped for 22 minutes through a midline incision then released. In the CLP model, the cecum was ligated and punctured with a 25 gauge needle. Kidneys were excised upon sacrifice 6 hours after each procedure and frozen in Optimal Cutting Temperature (OCT) compound. Slide preparation (CG000240_Demonstrated_Protocol_VisiumSpatialProtocols_TissuePreparationGuide_Rev_A, 10x Genomics), imaging (CG000241_VisiumImagingGuidelinesTN_Rev_A, 10x Genomics), mRNA extraction, library preparation, and sequencing (CG000239_VisiumSpatialGeneExpression_UserGuide_RevD, 10x Genomics) were conducted according to Visium Spatial Gene Expression protocols . Frozen transverse 10 碌m sections from the human nephrectomy or each murine model were placed within the etched frames of the capture areas on the active surface of the Visium Spatial Slide. Tissue sections were fixed in methanol and stained with hematoxylin and eosin (H&E). Stained tissue sections were permeabilized for 12 minutes, and the cDNA libraries were prepared and sequenced on an Illumina NovaSeq 6000 with 28bp+120bp paired-end sequencing mode.","2020-04-02 00:00:00","2021-06-05 00:00:00","Eadon Michael;Ricardo Melo Ferreira;Ying-Hua Cheng","","Melo Ferreira, Ricardo et al. “Integration of spatial and single-cell transcriptomics localizes epithelial cell-immune cross-talk in kidney injury.” JCI insight vol. 6,12 e147703. 22 Jun. 2021, doi:10.1172/jci.insight.147703","https://www.ncbi.nlm.nih.gov/geo/query/acc.cgi?acc=GSE171406;https://www.ncbi.nlm.nih.gov/geo/query/acc.cgi?acc=GSE171639","Illumina NovaSeq 6000","34003797","5"
"STDS0000096","Spatial transcriptomics unveils ZBTB11 as a regulator of cardiomyocyte degeneration in cardiomyopathy","Homo sapiens","Heart","IPS cells;Transmural cross-section of the heart","","0","0","0","Adult","","Tomo-seq","0","0","","","Aims | Arrhythmogenic cardiomyopathy (ACM) is an inherited cardiac disorder that is characterized by progressive fibro-fatty replacement of the myocardium, arrhythmias, and sudden death. While myocardial degeneration and fibro-fatty replacement occurs in specific locations, the underlying molecular changes remain poorly characterized. Here we aim to delineate local changes in gene expression to help identify new genes or pathways that are relevant for specific remodelling processes occurring during ACM. | Methods and Results | Using Tomo-Seq, a genome-wide transcriptional profiling with high spatial resolution, we created a transmural epicardial to endocardial gene expression atlas of an explanted ACM heart to gain molecular insights into disease-driving processes. This enabled us to link gene expression profiles to the different regional remodelling responses and allowed us to identify genes that are potentially relevant for disease progression. In doing we revealed BTB (broad-complex, tramtrack, bric-Ã -brac) domain containing 11 (ZBTB11) to be specifically enriched at sites of active fibrofatty replacement of myocardium. Immunohistochemistry indicated ZBTB11 to be enriched in cardiomyocytes flanking fibrofatty areas, which could be confirmed in multiple cardiomyopathy patients. Forced overexpression of ZBTB11 in iPS-derived cardiomyocytes showed ZBTB11 to function as a potent inducer of cardiomyocyte atrophy. | Conclusion | By combining spatial transcriptomics with classical histological approaches we identified gene expression changes underlying local remodelling responses in ACM. In doing so we found ZBTB11 to function as a relevant driver of cardiomyocyte atrophy. These data show the power of Tomo-Seq to unveil new molecular mechanisms and indicate ZBTB11 as a potential new target for cardiomyopathy. ","The dataset contains the following experiments: 1. Spatial transcriptomics by RNA-tomography (TomoSeq) on 20um sections on diseased heart. After isolation, we cryosectioned samples, extracted RNA from the individual sections, and amplified and barcoded mRNA using the CEL-seq protocol as in (Junker 2014, PMID: 25417113). Libraries were sequenced on Illumina NextSeq 500 using 75p paired end sequencing. 2. Bulk RNA-seq processed by the CEL-seq protocol. IPS derived cardiomyocytes were transduced with AAV-ZBTB11, AAV-GFP, or not transduced. 7 days after transduction, cells were harvested and RNA-Seq was performed. RNA-Seq on nontransduced control, AAV-GFP transduced and AAV-ZBTB11 transduced iPS derived cardiomyocytes.","2018-05-22 00:00:00","2021-05-24 00:00:00","Grégory Lacraz;Ábel Vértesy;Cornelis J. Boogerd;Ilaria Perini;Hesther de Ruiter;Andreas Brodehl;Petra van der Kraak;Mauro Giacca;Manon Huibers;Nicolaas de Jonge;Jan Philip Junker;Aryan Vink;Eva van Rooij","","Boogerd, Cornelis J et al. “Spatial transcriptomics unveils ZBTB11 as a regulator of cardiomyocyte degeneration in arrhythmogenic cardiomyopathy.” Cardiovascular research vol. 119,2 (2023): 477-491. doi:10.1093/cvr/cvac072","https://www.ncbi.nlm.nih.gov/geo/query/acc.cgi?acc=GSE114770","GPL18573","35576477","2"
"STDS0000006","A coordinated progression of progenitor cell states initiates urinary tract development","Mus musculus","Embryo","Trunk","","0","2385","27998","","","10x Visium;scRNA","9","4","E9.5 Pax2GFP Mus musculus embryos","","To study cell heterogeneity and state transitions in the developing urinary tract we performed spatial transcriptomics from the trunk of E9.5 Pax2GFP mouse embryos using the 10x Genomics Visium Spatial Gene Expression protocol","Identify cell heterogenity and state transitions in the developing urinary tract","2020-10-26 00:00:00","2021-05-18 00:00:00","SanchezFerras O;Pacis A;Sotiropoulou M;Zhang Y;Wang YC;Bourgey M;Bourque G;Ragoussis I;Bouchard M","alain.pacis@mcgill.ca","Sanchez-Ferras, Oraly et al. “A coordinated progression of progenitor cell states initiates urinary tract development.” Nature communications vol. 12,1 2627. 11 May. 2021, doi:10.1038/s41467-021-22931-5","","Illumina NovaSeq 6000","33976190","5"
"STDS0000133","Spatially resolved single-cell RNA-sequencing reveals expression heterogeneity in tumor microenvironment","Homo sapiens;Mus musculus","","","mouse cell line:3T3;human cell line:HEK293T","0","119985","121472","","","XYZeq","12","12","","","To better understand how individual cells function within an anatomical space, we developed XYZeq, a novel scRNA-seq workflow that uses combinatorial indexing in microwells to encode spatial metadata into scRNA-seq libraries. We used XYZeq to profile heterotopic mouse liver and spleen tumor models to capture transcriptomes from tens of thousands of cells across a total of eight tissue slices.","Spatially resolved single-cell RNA-sequencing from eight tissue sections of MC38-injected liver and spleen organs (samples L30C and L30C8 are from the same slice). Additional experiments using cell lines and comparing to droplet-based single-cell RNA-seq.","2021-01-07 00:00:00","2021-05-12 00:00:00","Y Lee;D Bogdanoff;Y Wang;G Hartoularos;A Marson;E D Chow;C J Ye","george.hartoularos@ucsf.edu","Lee, Youjin et al. “XYZeq: Spatially resolved single-cell RNA sequencing reveals expression heterogeneity in the tumor microenvironment.” Science advances vol. 7,17 eabg4755. 21 Apr. 2021, doi:10.1126/sciadv.abg4755","https://www.ncbi.nlm.nih.gov/geo/query/acc.cgi?acc=GSE164430","GPL21103","33883145","2"
"STDS0000028","Invasive Ductal Carcinoma Stained With Fluorescent CD3 Antibody","Homo sapiens","Breast","","","0","4727","36601",">50 days","","10x Visium","1","1","","","Visium Spatial Gene Expression Dataset processed with Spaceranger 1.2. Invasive ductal carcinoma was obtained from BioIVT: ASTERAND (Westbury, NY). Raw sequencing data (FASTQ and BAM files) are not included. This dataset is published in Nature Biotechnology: Spatial transcriptomics at subspot resolution with BayesSpace.","","2021-05-11 00:00:00","2021-05-11 00:00:00","","","","https://support.10xgenomics.com/spatial-gene-expression/datasets/1.2.0/V1_Human_Invasive_Ductal_Carcinoma","","","5"
"STDS0000090","Multi-resolution deconvolution of spatial transcriptomics data reveals continuous patterns of inflammation (Spatial scRNA-Seq)","Mus musculus","","","mixed -whole tissue","0","5850","32285","8 weeks;6 weeks","Female","10x Visium","0","0","Tumor","","The function of mammalian cells is largely influenced by their tissue microenvironment and by inter- celllular interactions. Advances in spatial transcriptomics open the way for studying these important determinants of cellular function, by enabling a transcriptome wide evaluation of gene expression in-situ. A critical limitation of the current technologies, however, is that their resolution is limited to regions (spots) of sizes well beyond that of a single cell, thus providing measurements for cell-aggregates which may mask critical interactions between neighboring cells of different types. While joint analysis with single cell RNA-sequencing (scRNA-seq) can be leveraged to alleviate this problem, current analyzes are limited to a discrete view of cell type proportion inside every spot. This limitation becomes critical in the common case where, even within a cell type, there is a continuum ofÂ  cell states, which can not be clearly demarcated and may reflect important differences in the cellsâ€™ function and interaction with their surrounding. To address this, we developed Deconvolution of Spatial Transcriptomics profiles using Variational Inference (DestVI), a probabilistic method for multi- resolution analysis for spatial transcriptomics, which explicitly models continuous variation within cell types. Using simulations, we demonstrate that DestVI is capable of providing higher resolution compared to the existing methods, and that it is also the first method to enable an estimate of gene expression by every cell type inside every spot. We then introduce an automated pipeline for analysis of a tissue, as well as comparison between tissues. We apply DestVI and this pipeline to study the response of lymph nodes to a pathogen and to explore the spatial organization of a mouse tumor model. In both cases, we demonstrate that DestVI can provide a reliable view of the organization of these tissues, and that it is capable of identifying important cell-type specific changes in gene expression - between different tissue regions or between conditions. DestVI is available as an open-source software in the scvi-tools codebase (https://scvi-tools.org).","Lymph nodes from mice treated with mycobacterium or PBS or MCA205 tumor were used. Auricular LNs and the MCA205 tumor were prepared according to Visium spatial protocols of tissue preparation guide (10x genomics). Firstly, freshly obtained tissue samples were snap frozen in liquid nitrogen, then embedded in chilled Optimal Cutting Temperature compound (OCT; Tissue-Tek) and frozen on dry ice, then stored at -80脗掳C in a sealed container for later use. For Visium samples preparation, OCT-embedded tissue blocks were cut to 10 脗碌m thick using a LEICA CM1950 machine and mounted on the Visium spatial gene expression slide.","2021-05-03 00:00:00","2021-05-07 00:00:00","Romain Lopez;Hadas Keren-Shaul;Baoguo Li;Pierre Boyeau;Michael I Jordan;Merav Kedmi;David Pilzer;Allon Wagner;Yoseph Addad;Nir Yosef;Ido Amit","ido.amit@weizmann.ac.il","Lopez, Romain et al. “DestVI identifies continuums of cell types in spatial transcriptomics data.” Nature biotechnology vol. 40,9 (2022): 1360-1369. doi:10.1038/s41587-022-01272-8","https://www.ncbi.nlm.nih.gov/geo/query/acc.cgi?acc=GSE173776","GPL24247","35449415","3"
"STDS0000085","Cell types and clonal relations in the mouse brain revealed by single-cell and spatial transcriptomics","Mus musculus","Brain","","","0","30667","27999","P11;P14","","10x Visium","0","0","","","We report TREX for simultaneous lineage tracking and expression profiling of dissociated cells from the juvenile mouse brain using single cell transcriptomics. We also developed Space-TREX enabling tracking and transcriptome profiling in intact tissue sections via Spatial Transcriptomics.","Lentiviral delivery of a transcribed barcode into neuroepithelial progenitor cells using in utero microinjection into the mouse forebrain at embryonic day 9.5 followed by RNA-seq analysis of barcoded cells at postnatal day 11-14.","2020-06-28 00:00:00","2021-04-08 00:00:00","Michael Ratz;Leonie von Berlin;Ludvig Larsson;Marcel Martin;Jakub O Westholm;Gioele La Manno;Joakim Lundeberg;Jonas Frisén","michael.ratz@ki.se","Ratz, Michael et al. “Clonal relations in the mouse brain revealed by single-cell and spatial transcriptomics.” Nature neuroscience vol. 25,3 (2022): 285-294. doi:10.1038/s41593-022-01011-x","https://www.ncbi.nlm.nih.gov/geo/query/acc.cgi?acc=GSE153424","GPL16085;GPL16417;GPL21626;GPL24247","35210624","5"
"STDS0000078","Spatially mapped single-cell chromatin accessibility","Homo sapiens;Mus musculus","Cortex","Human cortex","","0","0","134729","","","sci-ATAC-seq;sciMAP-ATAC-seq","0","0","","","sciMAP-ATAC as a technology to produce single-cell ATAC-seq data with cells mapped to spatially-defined regions.","Single-cell ATAC-seq data including sci-ATAC-seq and sciMAP-ATAC-seq.","2021-01-14 00:00:00","2021-03-16 00:00:00","Andrew C Adey;Casey A Thornton","adey@ohsu.edu","Thornton, Casey A et al. “Spatially mapped single-cell chromatin accessibility.” Nature communications vol. 12,1 1274. 24 Feb. 2021, doi:10.1038/s41467-021-21515-7","https://www.ncbi.nlm.nih.gov/geo/query/acc.cgi?acc=GSE164849","GPL18573;GPL19057","33627658","1"
"STDS0000107","The spatial landscape of gene expression isoforms in tissue sections","Mus musculus","Brain","Olfactory bulb;Hippocampus","","0","5978","31053","2 months","","10x Visium","3","0","","","Mouse brain 10x Genomics Visium Spatial Transcriptomics profiles sequence either with Illumina for standard profiling and Nanopore promethION long read sequencer for full-length profiling.","Visium Spatial Transcriptomics profiles of 2 mouse hippocampal samples (CBS1, CBS2) and 1 mouse olfactory bulk sample (MOB) sequence with short (illumina) and long (Nanopore) reads.","2020-07-06 00:00:00","2021-03-08 00:00:00","Kevin Lebrigand;Joseph Bergenstråhle;Kim Thrane;Pascal Babry;Rainer Waldmann;Joakim Lundeberg","","Kleshchevnikov, Vitalii et al. “Cell2location maps fine-grained cell types in spatial transcriptomics.” Nature biotechnology vol. 40,5 (2022): 661-671. doi:10.1038/s41587-021-01139-4","https://www.ncbi.nlm.nih.gov/geo/query/acc.cgi?acc=GSE153859","GPL19057;GPL26624","35027729","5"
"STDS0000089","Interleukin-17 governs hypoxic adaptation of injured epithelium [spatial transcriptomics]","Mus musculus","Skin","","","0","3909","32285","","","10x Visium","0","0","Injured skin","","To define the gene signature and spatial architecture of the skin after injury, we performed spatial transcriptomics from mouse unwounded and wounded skin.","Wild type (unwounded, wounded) and GFP-KI (wounded) skin were fresh frozen and sectioned at 10um thickness onto spatial transcriptomics (ST) slides for mRNA capture, followed by library preparation and sequencing. The GFP-KI genotype disrupts the Rorc gene.","2021-02-17 00:00:00","2021-02-22 00:00:00","Piotr Konieczny;Xing Yue;Ikjot Sidhu;Shruti Naik","Shruti.Naik@nyulangone.org","Konieczny, Piotr et al. “Interleukin-17 governs hypoxic adaptation of injured epithelium.” Science (New York, N.Y.) vol. 377,6602 (2022): eabg9302. doi:10.1126/science.abg9302","https://www.ncbi.nlm.nih.gov/geo/query/acc.cgi?acc=GSE166948","GPL24247","35709248","5"
